{
  "version": "1",
  "model_name": "user.Semantic-ImplicitLabel",
  "recipe": "collection.router",
  "components": ["MathLLM", "CodingLLM", "DefaultLLM", "EmbedModel"],
  "routing": {
    "candidates": ["MathLLM", "CodingLLM", "DefaultLLM"],
    "default_model": "DefaultLLM",
    "classifiers": [
      { "id": "topic", "type": "semantic_similarity", "model": "EmbedModel",
        "reference_phrases": { "coding": ["writes code"], "math": ["proves theorems"] },
        "default_label": "coding" }
    ],
    "rules": [
      { "id": "implicit-label-rule", "match": { "classifier": "topic", "min_score": 0.5 }, "route_to": "CodingLLM" }
    ]
  }
}
