{
  "version": "1",
  "model_name": "user.Router-L0a-Sugar-Form",
  "recipe": "collection.router",
  "components": ["TinyLLM", "BigLLM", "DefaultLLM", "RouterLLM"],
  "routing": {
    "candidates": ["TinyLLM", "BigLLM", "DefaultLLM"],
    "default_model": "DefaultLLM",
    "router": {
      "type": "llm",
      "model": "RouterLLM",
      "prompt": "Route everyday questions to TinyLLM; hard reasoning to BigLLM."
    }
  }
}
